{
  "schema_version": "1.0",
  "session_id": "sess-7f3a",
  "input": {
    "kind": "voice",
    "text": "isse cart mein daal do",
    "lang": "hi",
    "target_id": null,
    "phrase_id": null,
    "asr_meta": {
      "confidence": 0.82,
      "mic_level": 0.46,
      "alternatives": ["isse cart mein daal do", "ise kart mein dal do"]
    }
  },
  "page": {
    "schema_version": "1.0",
    "page_type": "product",
    "url": "https://www.amazon.in/dp/B0ZNTRA5G1",
    "site": "amazon.in",
    "products": [
      {
        "schema_version": "1.0",
        "id": "amazon.in:B0ZNTRA5G1",
        "url": "https://www.amazon.in/dp/B0ZNTRA5G1",
        "site": "amazon.in",
        "title": "Zentra Pulse 5G (Midnight Black, 8GB RAM, 128GB Storage)",
        "brand": "Zentra",
        "price": {
          "amount": 17999,
          "currency": "INR",
          "mrp": 24999
        },
        "rating": {
          "value": 4.2,
          "count": 3418
        },
        "availability": {
          "status": "in_stock",
          "text": "In stock"
        },
        "category": "Smartphones",
        "specs": {
          "battery": {
            "label": "Battery Capacity",
            "value": 5000,
            "unit": "mAh"
          },
          "ram": {
            "label": "RAM",
            "value": 8,
            "unit": "GB"
          },
          "storage": {
            "label": "Internal Storage",
            "value": 128,
            "unit": "GB"
          },
          "display_size": {
            "label": "Screen Size",
            "value": 6.67,
            "unit": "inches"
          },
          "refresh_rate": {
            "label": "Refresh Rate",
            "value": 120,
            "unit": "Hz"
          },
          "os": {
            "label": "Operating System",
            "value": "Android 15",
            "unit": null
          }
        },
        "variants": [
          {
            "name": "colour",
            "value": "Midnight Black",
            "selected": true,
            "available": true,
            "target_id": "t-swatch-black"
          },
          {
            "name": "colour",
            "value": "Sage Green",
            "selected": false,
            "available": true,
            "target_id": "t-swatch-green"
          }
        ],
        "images": [
          {
            "url": "https://m.media-amazon.com/images/I/zentra-pulse-5g-front.jpg",
            "alt": "Zentra Pulse 5G front and back, Midnight Black",
            "description": null,
            "ocr_text": null
          },
          {
            "url": "https://m.media-amazon.com/images/I/zentra-pulse-5g-box.jpg",
            "alt": "What's in the box",
            "description": null,
            "ocr_text": "Handset, 33W charger, USB-C cable, SIM ejector, protective case"
          }
        ],
        "delivery": {
          "text": "FREE delivery Tuesday, 14 October",
          "cost": {
            "amount": 0,
            "currency": "INR"
          },
          "date": "2026-10-14"
        },
        "seller": "Zentra Official Store",
        "sponsored": false,
        "reviews": {
          "basis_count": 690,
          "summary_text": "Customers like the battery life and display. Some mention the camera struggles in low light, and opinions on heating while gaming are mixed.",
          "insights": [
            {
              "topic": "Battery life",
              "sentiment": "positive",
              "mentions": {
                "total": 212,
                "positive": 189,
                "negative": 23
              }
            },
            {
              "topic": "Display",
              "sentiment": "positive",
              "mentions": {
                "total": 148,
                "positive": 131,
                "negative": 17
              }
            },
            {
              "topic": "Low-light camera",
              "sentiment": "negative",
              "mentions": {
                "total": 96,
                "positive": 28,
                "negative": 68
              }
            },
            {
              "topic": "Heating",
              "sentiment": "mixed",
              "mentions": {
                "total": 54,
                "positive": 25,
                "negative": 29
              }
            }
          ],
          "histogram": {
            "1": 274,
            "2": 137,
            "3": 307,
            "4": 820,
            "5": 1880
          },
          "items": [
            {
              "rating": 5,
              "title": "Battery lasts two days",
              "text": "With normal use I charge it every second day. The screen is bright outdoors.",
              "date": "2026-09-21",
              "verified": true
            },
            {
              "rating": 4,
              "title": "Good value",
              "text": "Smooth for daily apps and the 120Hz screen feels fast. Night photos are average.",
              "date": "2026-09-18",
              "verified": true
            },
            {
              "rating": 2,
              "title": "Camera disappointing at night",
              "text": "Daylight photos are fine but indoor and night photos are noisy.",
              "date": "2026-09-12",
              "verified": true
            },
            {
              "rating": 4,
              "title": null,
              "text": "Gets a little warm during long games, otherwise no complaints.",
              "date": "2026-09-05",
              "verified": false
            },
            {
              "rating": 5,
              "title": "Easy for my father to use",
              "text": "Large text and loud speaker. He uses it for calls and UPI without help.",
              "date": "2026-08-30",
              "verified": true
            }
          ]
        },
        "source": {
          "method": "adapter",
          "extracted_at": "2026-10-10T10:00:00Z",
          "fields": {
            "title": "jsonld",
            "price": "adapter",
            "specs": "adapter",
            "reviews.insights": "serpapi"
          }
        },
        "missing": []
      }
    ],
    "orders": [],
    "targets": [
      {
        "schema_version": "1.0",
        "id": "t-search",
        "kind": "input",
        "label": "Search Amazon.in",
        "zone": "search",
        "state": null,
        "colour_name": null
      },
      {
        "schema_version": "1.0",
        "id": "t-swatch-black",
        "kind": "swatch",
        "label": "Midnight Black",
        "zone": "product",
        "state": {
          "disabled": false,
          "selected": true,
          "expanded": false
        },
        "colour_name": "Midnight Black"
      },
      {
        "schema_version": "1.0",
        "id": "t-swatch-green",
        "kind": "swatch",
        "label": "Sage Green",
        "zone": "product",
        "state": {
          "disabled": false,
          "selected": false,
          "expanded": false
        },
        "colour_name": "Sage Green"
      },
      {
        "schema_version": "1.0",
        "id": "t-qty",
        "kind": "select",
        "label": "Quantity",
        "zone": "product",
        "state": {
          "disabled": false,
          "selected": false,
          "expanded": false
        },
        "colour_name": null
      },
      {
        "schema_version": "1.0",
        "id": "t-add-to-cart",
        "kind": "button",
        "label": "Add to Cart",
        "zone": "product",
        "state": {
          "disabled": false,
          "selected": false,
          "expanded": false
        },
        "colour_name": null
      },
      {
        "schema_version": "1.0",
        "id": "t-buy-now",
        "kind": "button",
        "label": "Buy Now",
        "zone": "product",
        "state": {
          "disabled": false,
          "selected": false,
          "expanded": false
        },
        "colour_name": null
      },
      {
        "schema_version": "1.0",
        "id": "t-cart",
        "kind": "link",
        "label": "Cart",
        "zone": "cart",
        "state": null,
        "colour_name": null
      }
    ],
    "secure_zone_active": false
  },
  "prefs": {
    "lang": "hi",
    "tts_rate": 0.85,
    "text_scale": 1.5,
    "verbosity": "short",
    "lite_mode": false,
    "text_first": false,
    "switch_key": "Space",
    "preferred_payment": "upi"
  },
  "history": [
    {
      "role": "user",
      "text": "What do the reviews say?"
    },
    {
      "role": "assistant",
      "text": "Based on 690 reviews, people like the battery and display. The main complaint is low-light photos."
    }
  ]
}
